{
  "schema_version": "1.0",
  "status": "accepted",
  "recorded_at": "2026-08-28T02:21:23.209529+00:00",
  "evaluator": "codex",
  "submission_commit": "f12b1cda2191dbc3e1361d45a309dad3cccd2172",
  "source": {
    "mode": "compiled_from_submission",
    "report_tex": "solver/report/report.tex",
    "sha256": "498917506d5312a110cbd122e2a7e104c7612888c36a964868830594b78ff16d",
    "bytes": 2847495,
    "workspace_relative_pdf": null,
    "build_command": "git archive f12b1cda2191dbc3e1361d45a309dad3cccd2172 | tar -x; (cd solver/report && latexmk -pdf -interaction=nonstopmode -halt-on-error report.tex)"
  },
  "snapshot": {
    "filename": "report.pdf",
    "media_type": "application/pdf",
    "sha256": "498917506d5312a110cbd122e2a7e104c7612888c36a964868830594b78ff16d",
    "bytes": 2847495,
    "pdf_header_valid": true,
    "pdf_eof_valid": true
  },
  "appropriateness": {
    "approved": true,
    "visually_reviewed": true,
    "main_report_confirmed": true,
    "readable": true,
    "notes": "Rebuilt tracked solver/report/report.tex from immutable submission f12b1cda2191dbc3e1361d45a309dad3cccd2172 using latexmk; rendered all 17 pages and visually inspected title, middle, and terminal pages. It is the readable main CFD benchmark report."
  }
}
