{
  "schema_version": "1.0",
  "status": "accepted",
  "recorded_at": "2026-08-28T02:20:39.125905+00:00",
  "evaluator": "codex",
  "submission_commit": "47dff36bef32a0a978e276e3a2683e14444c2acc",
  "source": {
    "mode": "compiled_from_submission",
    "report_tex": "solver/report/report.tex",
    "sha256": "9f0e3fd88a5e7169ea717fb1e1a658803552ca1a94528a8084596f88f3f9e12e",
    "bytes": 2226349,
    "workspace_relative_pdf": null,
    "build_command": "git archive 47dff36bef32a0a978e276e3a2683e14444c2acc | tar -x; (cd solver/report && latexmk -pdf -interaction=nonstopmode -halt-on-error report.tex)"
  },
  "snapshot": {
    "filename": "report.pdf",
    "media_type": "application/pdf",
    "sha256": "9f0e3fd88a5e7169ea717fb1e1a658803552ca1a94528a8084596f88f3f9e12e",
    "bytes": 2226349,
    "pdf_header_valid": true,
    "pdf_eof_valid": true
  },
  "appropriateness": {
    "approved": true,
    "visually_reviewed": true,
    "main_report_confirmed": true,
    "readable": true,
    "notes": "Rebuilt tracked solver/report/report.tex from immutable submission 47dff36bef32a0a978e276e3a2683e14444c2acc using latexmk; rendered all 17 pages and visually inspected title, middle, and terminal pages. It is the readable main CFD benchmark report."
  }
}
