{
  "schema_version": "1.0",
  "status": "accepted",
  "recorded_at": "2026-08-28T03:23:59.541363+00:00",
  "evaluator": "codex",
  "submission_commit": "60a259515e88a436ca47c6c9b1d6157db38eb4c2",
  "source": {
    "mode": "workspace_existing",
    "report_tex": "solver/report/report.tex",
    "sha256": "0be615d1ca911e103ab0e47f06ad4488d36cfa9f15d0a646b364ee0abed6cc61",
    "bytes": 2628287,
    "workspace_relative_pdf": "solver/report/report.pdf",
    "build_command": null
  },
  "snapshot": {
    "filename": "report.pdf",
    "media_type": "application/pdf",
    "sha256": "0be615d1ca911e103ab0e47f06ad4488d36cfa9f15d0a646b364ee0abed6cc61",
    "bytes": 2628287,
    "pdf_header_valid": true,
    "pdf_eof_valid": true
  },
  "appropriateness": {
    "approved": true,
    "visually_reviewed": true,
    "main_report_confirmed": true,
    "readable": true,
    "notes": "Opened all 24 pages of the sibling compiled report PDF. It is the readable main benchmark report corresponding to solver/report/report.tex and includes the evaluated source-backed methods, all-case plots, and Re200 analysis; immutable curation excludes the generated source figures."
  }
}
