{
  "schema_version": "1.0",
  "status": "accepted",
  "recorded_at": "2026-08-28T02:21:40.082921+00:00",
  "evaluator": "codex",
  "submission_commit": "4733d433554726e4503a20b23df51c43e2d272e8",
  "source": {
    "mode": "compiled_from_submission",
    "report_tex": "solver/report/report.tex",
    "sha256": "fc0b0c83f4fa3cefa82e9abab4fd143f74aec52f7ab23413d57ebadf0829fb6d",
    "bytes": 225188,
    "workspace_relative_pdf": null,
    "build_command": "git archive 4733d433554726e4503a20b23df51c43e2d272e8 | tar -x; (cd solver/report && latexmk -pdf -interaction=nonstopmode -halt-on-error report.tex)"
  },
  "snapshot": {
    "filename": "report.pdf",
    "media_type": "application/pdf",
    "sha256": "fc0b0c83f4fa3cefa82e9abab4fd143f74aec52f7ab23413d57ebadf0829fb6d",
    "bytes": 225188,
    "pdf_header_valid": true,
    "pdf_eof_valid": true
  },
  "appropriateness": {
    "approved": true,
    "visually_reviewed": true,
    "main_report_confirmed": true,
    "readable": true,
    "notes": "Rebuilt tracked solver/report/report.tex from immutable submission 4733d433554726e4503a20b23df51c43e2d272e8 using latexmk; rendered all 7 pages and visually inspected title, middle, and terminal pages. It is the readable main CFD benchmark report."
  }
}
