{
  "schema_version": "1.0",
  "status": "accepted",
  "recorded_at": "2026-08-28T02:20:36.645324+00:00",
  "evaluator": "codex",
  "submission_commit": "eaae575d90bfb39a57702e0fcb8dc5e98163568f",
  "source": {
    "mode": "compiled_from_submission",
    "report_tex": "solver/report/report.tex",
    "sha256": "e32e3624a4e5a61c96f92b85600e0fe1f376b4327d5dd0bf0376633e231541e6",
    "bytes": 1124952,
    "workspace_relative_pdf": null,
    "build_command": "git archive eaae575d90bfb39a57702e0fcb8dc5e98163568f | tar -x; (cd solver/report && latexmk -pdf -interaction=nonstopmode -halt-on-error report.tex)"
  },
  "snapshot": {
    "filename": "report.pdf",
    "media_type": "application/pdf",
    "sha256": "e32e3624a4e5a61c96f92b85600e0fe1f376b4327d5dd0bf0376633e231541e6",
    "bytes": 1124952,
    "pdf_header_valid": true,
    "pdf_eof_valid": true
  },
  "appropriateness": {
    "approved": true,
    "visually_reviewed": true,
    "main_report_confirmed": true,
    "readable": true,
    "notes": "Rebuilt tracked solver/report/report.tex from immutable submission eaae575d90bfb39a57702e0fcb8dc5e98163568f using latexmk; rendered all 21 pages and visually inspected title, middle, and terminal pages. It is the readable main CFD benchmark report."
  }
}
