{
  "schema_version": "1.0",
  "status": "absent",
  "recorded_at": "2026-08-28T02:22:00.512182+00:00",
  "evaluator": "codex",
  "submission_commit": "17a5ef3c78cda02d6707e1f94858184060318216",
  "source": null,
  "snapshot": null,
  "appropriateness": {
    "approved": false,
    "visually_reviewed": false,
    "main_report_confirmed": false,
    "readable": false,
    "notes": "Tracked main TeX solver/report/report.tex at immutable submission 17a5ef3c78cda02d6707e1f94858184060318216 failed isolated git-archive latexmk -pdf build, so committed sources/assets cannot produce an appropriate main report PDF."
  }
}
