{
  "schema_version": "1.0",
  "status": "accepted",
  "recorded_at": "2026-08-28T02:21:20.869227+00:00",
  "evaluator": "codex",
  "submission_commit": "f4ebc4345397502dac9aa1dc2ad0be101f6d9c4b",
  "source": {
    "mode": "compiled_from_submission",
    "report_tex": "solver/report/report.tex",
    "sha256": "9bd2e0288dcbbcba07aedd2b13d725b5dd0db084e0e94129e2d75601b1e2f31b",
    "bytes": 5441598,
    "workspace_relative_pdf": null,
    "build_command": "git archive f4ebc4345397502dac9aa1dc2ad0be101f6d9c4b | tar -x; (cd solver/report && latexmk -pdf -interaction=nonstopmode -halt-on-error report.tex)"
  },
  "snapshot": {
    "filename": "report.pdf",
    "media_type": "application/pdf",
    "sha256": "9bd2e0288dcbbcba07aedd2b13d725b5dd0db084e0e94129e2d75601b1e2f31b",
    "bytes": 5441598,
    "pdf_header_valid": true,
    "pdf_eof_valid": true
  },
  "appropriateness": {
    "approved": true,
    "visually_reviewed": true,
    "main_report_confirmed": true,
    "readable": true,
    "notes": "Rebuilt tracked solver/report/report.tex from immutable submission f4ebc4345397502dac9aa1dc2ad0be101f6d9c4b using latexmk; rendered all 22 pages and visually inspected title, middle, and terminal pages. It is the readable main CFD benchmark report."
  }
}
