{
  "schema_version": "1.0",
  "status": "accepted",
  "recorded_at": "2026-08-28T02:21:01.738122+00:00",
  "evaluator": "codex",
  "submission_commit": "af2fcc3ebfb2f58b8256f3b7604ba1b4373dfb4c",
  "source": {
    "mode": "compiled_from_submission",
    "report_tex": "solver/report/report.tex",
    "sha256": "d273c00b0ed72c59e9acce52b3ae0b6c9d30d9e1228c5c4a793a410e6563f5a6",
    "bytes": 4609243,
    "workspace_relative_pdf": null,
    "build_command": "git archive af2fcc3ebfb2f58b8256f3b7604ba1b4373dfb4c | tar -x; (cd solver/report && latexmk -pdf -interaction=nonstopmode -halt-on-error report.tex)"
  },
  "snapshot": {
    "filename": "report.pdf",
    "media_type": "application/pdf",
    "sha256": "d273c00b0ed72c59e9acce52b3ae0b6c9d30d9e1228c5c4a793a410e6563f5a6",
    "bytes": 4609243,
    "pdf_header_valid": true,
    "pdf_eof_valid": true
  },
  "appropriateness": {
    "approved": true,
    "visually_reviewed": true,
    "main_report_confirmed": true,
    "readable": true,
    "notes": "Rebuilt tracked solver/report/report.tex from immutable submission af2fcc3ebfb2f58b8256f3b7604ba1b4373dfb4c using latexmk; rendered all 48 pages and visually inspected title, middle, and terminal pages. It is the readable main CFD benchmark report."
  }
}
