{
  "schema_version": "1.0",
  "status": "accepted",
  "recorded_at": "2026-08-28T02:21:16.855355+00:00",
  "evaluator": "codex",
  "submission_commit": "55b24264cfb94fe01c32133e30885c75cb2e17bf",
  "source": {
    "mode": "compiled_from_submission",
    "report_tex": "solver/report/report.tex",
    "sha256": "d9caad25c47acf2350146a6dd67b22be30e158702adea7e8b2ced58e00a8dc34",
    "bytes": 10027931,
    "workspace_relative_pdf": null,
    "build_command": "git archive 55b24264cfb94fe01c32133e30885c75cb2e17bf | tar -x; (cd solver/report && latexmk -pdf -interaction=nonstopmode -halt-on-error report.tex)"
  },
  "snapshot": {
    "filename": "report.pdf",
    "media_type": "application/pdf",
    "sha256": "d9caad25c47acf2350146a6dd67b22be30e158702adea7e8b2ced58e00a8dc34",
    "bytes": 10027931,
    "pdf_header_valid": true,
    "pdf_eof_valid": true
  },
  "appropriateness": {
    "approved": true,
    "visually_reviewed": true,
    "main_report_confirmed": true,
    "readable": true,
    "notes": "Rebuilt tracked solver/report/report.tex from immutable submission 55b24264cfb94fe01c32133e30885c75cb2e17bf using latexmk; rendered all 16 pages and visually inspected title, middle, and terminal pages. It is the readable main CFD benchmark report."
  }
}
