{
  "schema_version": "1.0",
  "status": "accepted",
  "recorded_at": "2026-08-28T02:21:39.585941+00:00",
  "evaluator": "codex",
  "submission_commit": "e272cd3f195e4d7cf490acd9be3578c7893056e0",
  "source": {
    "mode": "compiled_from_submission",
    "report_tex": "solver/report/report.tex",
    "sha256": "943b25c59c7cd12eda2c316dd34ffb187576f5b36f43bf089a5677cff0986573",
    "bytes": 1217433,
    "workspace_relative_pdf": null,
    "build_command": "git archive e272cd3f195e4d7cf490acd9be3578c7893056e0 | tar -x; (cd solver/report && latexmk -pdf -interaction=nonstopmode -halt-on-error report.tex)"
  },
  "snapshot": {
    "filename": "report.pdf",
    "media_type": "application/pdf",
    "sha256": "943b25c59c7cd12eda2c316dd34ffb187576f5b36f43bf089a5677cff0986573",
    "bytes": 1217433,
    "pdf_header_valid": true,
    "pdf_eof_valid": true
  },
  "appropriateness": {
    "approved": true,
    "visually_reviewed": true,
    "main_report_confirmed": true,
    "readable": true,
    "notes": "Rebuilt tracked solver/report/report.tex from immutable submission e272cd3f195e4d7cf490acd9be3578c7893056e0 using latexmk; rendered all 11 pages and visually inspected title, middle, and terminal pages. It is the readable main CFD benchmark report."
  }
}
