{
  "schema_version": "1.0",
  "status": "accepted",
  "recorded_at": "2026-08-28T02:21:39.066493+00:00",
  "evaluator": "codex",
  "submission_commit": "51d1a785f4a25b3cff7e79294459ed22579addb7",
  "source": {
    "mode": "compiled_from_submission",
    "report_tex": "solver/report/report.tex",
    "sha256": "a5de8268c49db18ffdb272a1427701fa8daf8a7f7a43d9e88f559989bd5ec5f9",
    "bytes": 2152949,
    "workspace_relative_pdf": null,
    "build_command": "git archive 51d1a785f4a25b3cff7e79294459ed22579addb7 | tar -x; (cd solver/report && latexmk -pdf -interaction=nonstopmode -halt-on-error report.tex)"
  },
  "snapshot": {
    "filename": "report.pdf",
    "media_type": "application/pdf",
    "sha256": "a5de8268c49db18ffdb272a1427701fa8daf8a7f7a43d9e88f559989bd5ec5f9",
    "bytes": 2152949,
    "pdf_header_valid": true,
    "pdf_eof_valid": true
  },
  "appropriateness": {
    "approved": true,
    "visually_reviewed": true,
    "main_report_confirmed": true,
    "readable": true,
    "notes": "Rebuilt tracked solver/report/report.tex from immutable submission 51d1a785f4a25b3cff7e79294459ed22579addb7 using latexmk; rendered all 17 pages and visually inspected title, middle, and terminal pages. It is the readable main CFD benchmark report."
  }
}
