{
  "schema_version": "1.0",
  "status": "accepted",
  "recorded_at": "2026-08-28T02:20:39.615361+00:00",
  "evaluator": "codex",
  "submission_commit": "97bdc69583d3f31441466cb7349d5632494e3897",
  "source": {
    "mode": "compiled_from_submission",
    "report_tex": "solver/report/report.tex",
    "sha256": "e4e7e10ff2d0b08faadba5d862caae920b339af5cb2d796d929918e05b8446e3",
    "bytes": 3294497,
    "workspace_relative_pdf": null,
    "build_command": "git archive 97bdc69583d3f31441466cb7349d5632494e3897 | tar -x; (cd solver/report && latexmk -pdf -interaction=nonstopmode -halt-on-error report.tex)"
  },
  "snapshot": {
    "filename": "report.pdf",
    "media_type": "application/pdf",
    "sha256": "e4e7e10ff2d0b08faadba5d862caae920b339af5cb2d796d929918e05b8446e3",
    "bytes": 3294497,
    "pdf_header_valid": true,
    "pdf_eof_valid": true
  },
  "appropriateness": {
    "approved": true,
    "visually_reviewed": true,
    "main_report_confirmed": true,
    "readable": true,
    "notes": "Rebuilt tracked solver/report/report.tex from immutable submission 97bdc69583d3f31441466cb7349d5632494e3897 using latexmk; rendered all 12 pages and visually inspected title, middle, and terminal pages. It is the readable main CFD benchmark report."
  }
}
